{
  "id": "token-meter",
  "name": "Token Meter",
  "version": "1.0.0",
  "apiVersion": 1,
  "engines": {
    "pluginHost": ">=1.1.0 <2.0.0"
  },
  "description": "Shows the live output speed and the total tokens of the conversation in the status bar",
  "author": "codeg-community",
  "category": "utility",
  "permissions": [
    "ui"
  ],
  "main": "dist/index.js",
  "configSchema": {
    "type": "object",
    "properties": {
      "position": {
        "type": "string",
        "title": "Status bar side",
        "description": "Which side of the status bar shows the meter. Takes effect the next time the plugin is enabled.",
        "enum": [
          "left",
          "right"
        ],
        "default": "left"
      }
    }
  }
}
