{
  "id": "dsh-cyber-glow",
  "name": "DSH Cyber Glow",
  "version": "1.0.0",
  "apiVersion": 1,
  "engines": {
    "pluginHost": ">=1.0.0 <2.0.0"
  },
  "description": "DeepSeek Harness inspired dark translucent cyber neon glow styling",
  "author": "codeg-community",
  "category": "appearance",
  "permissions": [
    "ui"
  ],
  "styles": [
    "styles/cyber-glow.css"
  ]
}
